sys_id,instance,instance.number,string_value,sys_updated_on,response_category
6a8bcd61875d0550b4c1eb183cbb35cb,2227092987d9c154f03411373cbb3514,AINST4214989,"Quick response, easy to solve problems through chat, helpful and friendly techs - what's not to love?!?!",2022-01-26 20:22:29,Kudo
a9a909e98791cdd0ab2096093cbb353c,5d89a8e997550554cf74fbc3f153af19,AINST4214044,It was easy and efficient.  I used the ServiceNow system to generate the request rather than pick up the phone and wait on hold.  The direction provided was perfect and it solved the problem.,2022-01-26 20:14:13,Kudo
9593012d879d0554f2187487cebb3553,c2bffc65875d4594c5520f6d0ebb35b8,AINST4214777,Excellent customer service provided by Ashley.,2022-01-26 19:47:43,Kudo
58ba523987b10198f03411373cbb355b,8de99ebd877dcd90e95263583cbb3518,AINST4301193,"excellent service, kind and patient",2022-02-21 17:18:10,Kudo
e19181ad875dc1d00fdced3d0ebb3524,77e0c9ed879d45106eb197183cbb3579,AINST4214807,"Technician on the phone was incredibly helpful, explained things well and guided me to my answer quickly.",2022-01-26 19:38:59,Kudo
2eeef11d8795c5145c4a0e96cebb3553,8ed5eef487594510b4c1eb183cbb3536,AINST4204182,The tech was vey patient. he understood what the problem the was with the phones on the unit. he had took time to explain to me what he was doing on his end to resolve the problem. very professional . Thank you for helping the 2 west unit,2022-01-26 05:28:28,Kudo
c615c51d875141142e0633773cbb35ba,373481518715cd10b4c1eb183cbb35b1,AINST4211935,"Great, fast service!",2022-01-26 01:15:51,Kudo
5d800d5597d10154cf74fbc3f153af18,e37d345987114dd0ebb255b83cbb3537,AINST4211828,Great and friendly service!,2022-01-26 00:55:50,Kudo
f35897098791c910b4c1eb183cbb35c0,9697df0d8799c954c5520f6d0ebb3527,AINST4208446,personal and great service,2022-01-25 17:20:49,Kudo
295ea385879501106eb197183cbb355b,8611421c87910990ab2096093cbb3542,AINST4201071,Great and quick service,2022-01-25 18:56:47,Kudo
e72ce70187190d14f2187487cebb3533,af89a70987590d54c5520f6d0ebb3591,AINST4209096,The Tech was very helpful and I am not sure what if any other options exist.,2022-01-25 18:47:22,Kudo
331b274d87990d54c5520f6d0ebb350b,ad0fd38987d981148b81322d0ebb3501,AINST4208717,"Excellent service, thanks Michelle!",2022-01-25 18:42:44,Kudo
f06e9fc5879d85d0e95263583cbb3572,a679934187d1c910b4c1eb183cbb35a3,AINST4208513,"Javier - Great customer service and great personality
Kyle - Very knowledgeable and helpful",2022-01-25 17:47:06,Kudo
aea0d7c287f181506eb197183cbb3541,3755eaa48731cd14b4c1eb183cbb35ab,AINST4292828,"Again, I expect IT technicians  knowledge of informational technology is better than mine.  And I expect to get help. 
I expect technicians get updated on  any changes/renovations of KP computer system.  
Thank you.",2022-02-22 15:52:28,Kudo
5efc5349875101106eb197183cbb35dd,83fb1bc58799c914f2187487cebb3505,AINST4208602,Client group provided excellent Customer Service and followed up on the request.,2022-01-25 17:40:55,Kudo
eee9174187d50dd02e0633773cbb352f,91c8df4987d14990b798b996cebb357d,AINST4208493,"great customer service, pleasant experience, concern was quickly addressed",2022-01-25 17:27:34,Kudo
23f21f06977dcd50cf74fbc3f153af93,3b42dbce87f5055c47f1ca2e0ebb3524,AINST4304170,The IT tech that I worked with was great. He was so nice and friendly! What an asset to KP he is!,2022-02-22 16:02:38,Kudo
a640c119879585145c4a0e96cebb3530,9fdc7cd187114dd0ebb255b83cbb359c,AINST4211816,Great and friendly service!,2022-01-26 00:54:51,Kudo
d88f0345879905d0ab2096093cbb3544,f85e0f0587d18d1047f1ca2e0ebb359b,AINST4208176,The customer service was great! Very enthusiastic to help.,2022-01-25 16:42:05,Kudo
29778bc9879d4914f03411373cbb35ed,6aa48fc187d50990b798b996cebb35b1,AINST4207945,EXCELLENT CUSTOMER SERVICE & QUICK TO RESPOND TO MY ISSUE,2022-01-25 16:06:56,Kudo
9b12e3ce87394dd0b798b996cebb3586,4433a88e87b101d0c3f2ff77cebb35a1,AINST4303158,Excellent service,2022-02-22 17:08:42,Kudo
cbdbb24987dd01145c4a0e96cebb35ff,f41a7e01879545d0e95263583cbb354c,AINST4207749,excellent customer  service and professionalism,2022-01-25 15:16:16,Kudo
26880505871d45d06eb197183cbb35d6,11e912b0879d0114c3f2ff77cebb35b1,AINST4203709,Great customer service! Went out of his way to help me.,2022-01-25 06:52:25,Kudo
55aa2386873d41902e0633773cbb3577,7ba93f7987b10594c5520f6d0ebb35f7,AINST4302912,My issue was resolved in less than 24 hours . Tech very helpful .,2022-02-22 17:45:59,Kudo
6cc7ac8d87954514c3f2ff77cebb3587,f6af9b7087110514c3f2ff77cebb3568,AINST4205867,"I spoke to three people regarding my issue. except for one person, the two others were extremely helpful and patient (Julian and Joe). great service!",2022-01-25 04:29:11,Kudo
4bc6370187198990b798b996cebb3559,2d44b785879dcd1047f1ca2e0ebb35da,AINST4209643,Great customer service!,2022-01-25 19:33:45,Kudo
0f1e920e977d8d50cf74fbc3f153afc0,860a9242873941d0c3f2ff77cebb3557,AINST4303540,Great quick service this morning tech was very helpful in resolving my problem quickly,2022-02-22 12:11:35,Kudo
9d740c1187d1c5d0ab2096093cbb35be,4561a3b2874d0d10e95263583cbb3574,AINST4182920,the technician was very helpful with assisting with my issue. i was able to get my issue resolved in a timely manner.,2022-01-25 20:33:26,Kudo
92188019875d01106eb197183cbb351d,5da133c1871d0d14f2187487cebb3533,AINST4209546,"Phil at the service desk was efficient, got me on site I needed to check my pts in. Great service Phil! Daniel at IT made my screen clear and able to see better, helped me with sign on, so that I could log on faster, Kudos Daniel!  Thank you both for making my work tools so much easier to use.",2022-01-25 20:49:20,Kudo
ef5bb8dd875d45148b81322d0ebb35ab,536f509587518d10b4c1eb183cbb35fd,AINST4210963,The service I received was simple and the IT gentleman that helped was calm and curteous .,2022-01-26 00:33:20,Kudo
7086173987fd4198f03411373cbb355a,fc6013b587f101d05c4a0e96cebb354a,AINST4302279,excellent service,2022-02-21 21:39:32,Kudo
4748bcd5875d0dd0ebb255b83cbb35da,7ba7b4d5875185145c4a0e96cebb35f7,AINST4211663,Sandi provided excellent customer service and was very peasant to speak with. We were able to resole the issue quickly.,2022-01-26 00:19:55,Kudo
6fc374d587d945148b81322d0ebb356a,5513f41187d989d0e95263583cbb35cd,AINST4211515,Great Customer Service.,2022-01-26 00:00:18,Kudo
2207abfd87398510ab2096093cbb35fc,61266fbd87b9c194c5520f6d0ebb3577,AINST4302624,"Quick response time and great customer service from Kevin. He quickly diagnosed the problem, fixed it, and was fun to work with.",2022-02-21 22:51:44,Kudo
f5abaf7987fd8d106eb197183cbb3500,1fe1af3987b54d502e0633773cbb357e,AINST4302567,GREAT 5 STAR SERVICE & QUICK RESOLUTION,2022-02-21 23:11:54,Kudo
2c9cd4c6877d01d08b81322d0ebb355b,217b71e087f949d847f1ca2e0ebb3545,AINST4291523,"Really fast service, quick to answer the phone and help me remotely on my laptop at home!  excellent",2022-02-22 02:45:38,Kudo
271d54dd8759c914c3f2ff77cebb3516,bb77dc5d871109d0ab2096093cbb35e4,AINST4210726,"Timely, cheerful and helpful customer service!",2022-01-25 22:21:10,Kudo
c73bd45d87dd05145c4a0e96cebb3527,937544dd97d18d14cf74fbc3f153af6e,AINST4210202,excellent service. thank you,2022-01-25 22:12:58,Kudo
0bb224c287798d10ebb255b83cbb3585,13d5a1e087bd8d100fdced3d0ebb35db,AINST4290954,quick and easy service,2022-02-22 03:12:33,Kudo
cf57585987998d54c5520f6d0ebb3598,f046d0dd87ddc5d0ab2096093cbb3589,AINST4210685,excellent service!,2022-01-25 21:56:01,Kudo
ed47d8158759c9d0ebb255b83cbb3577,6476905d871d05145c4a0e96cebb35f8,AINST4210693,Shiraz provided excellent service and was extremely helpful with my computer update.,2022-01-25 21:55:39,Kudo
f48358d987d1c914c3f2ff77cebb3502,23c20c1d879d455052beec273cbb3550,AINST4210103,The IT person was helpful and responded quickly to pick up my old device.  Great service!  He made sure I know what to take care of on my old device before coming to pick it up.  Thanks!,2022-01-25 21:39:13,Kudo
4c8560ce87bd01d08b81322d0ebb35cf,b81a43b187f549d0b798b996cebb3573,AINST4302180,Freddy is always so helpful and courteous and provided excellent customer service.,2022-02-22 03:24:38,Kudo
7c78cc1d8751855052beec273cbb358f,0f132b098791cd1047f1ca2e0ebb3555,AINST4208858,excellent service,2022-01-25 20:50:52,Kudo
ae7fe5a9879d0d145c4a0e96cebb355a,a6ddada1871dc1d0b798b996cebb35c1,AINST4216085,I received excellent service from Anthony Ortega.  He is a true problem solver!,2022-01-26 22:59:30,Kudo
ee40f16587518d5052beec273cbb35c2,9407a5ad871d4550b4c1eb183cbb3562,AINST4215884,Great communication and excellent service,2022-01-26 23:03:03,Kudo
7aa58235877d0194b4c1eb183cbb3550,ed91467d8775c910ebb255b83cbb3583,AINST4300637,Great customer service.,2022-02-21 15:46:19,Kudo
a667cb428715cd14ab2096093cbb3573,b76ea44287d58510f03411373cbb358e,AINST4222761,Great customer service / Problem resolved quickly. Kudos!!,2022-01-28 18:40:39,Kudo
12fa130687110154ab2096093cbb3539,a141b2fd87510d54c3f2ff77cebb350f,AINST4221257,The person was so nice and they never make me feel dumb for not knowing simple computer stuff. I am a provider in medicine and am not tech savvy! Appreciate it.,2022-01-28 20:06:06,Kudo
0d50a3bc87b909500fdced3d0ebb3525,bbf81ffc87f94d90b798b996cebb353a,AINST4296737,Reginald gave EXCELLENT customer service and solved my issue.,2022-02-18 19:48:30,Kudo
b01f8f4687914594f2187487cebb355c,ce1e0fc68791c194c3f2ff77cebb35b5,AINST4224845,"As long as Robert Joyce is involved in the service I know that others will be satisfied. Knowledgeable, service oriented, did not come up with an excuse of why he couldn't assist as others have and just close your ticket. He is great. Thank you",2022-01-28 19:14:08,Kudo
84dec30e8719cd14ab2096093cbb3578,66d8287b970545d0cf74fbc3f153af06,AINST4196027,great service,2022-01-28 19:12:58,Kudo
a6be4bca8719cd14ab2096093cbb3517,0010f631879d0d14ebb255b83cbb350d,AINST4221218,great service,2022-01-28 19:12:36,Kudo
4b7dc30e87d18114b798b996cebb356d,058a8f02879985542e0633773cbb35f1,AINST4224772,"Paul, the Service Desk Representative was friendly, knowledgeable, professional and took initiative to provide me information which was extremely helpful. Excellent customer service. Thank you!",2022-01-28 19:07:10,Kudo
beac07ca979dc194cf74fbc3f153af52,ef2a8c4a87958914ab2096093cbb35e7,AINST4222573,Fast great service,2022-01-28 19:03:36,Kudo
d163438e87dd45d4c5520f6d0ebb35da,388d3e42871d8d14ab2096093cbb35ab,AINST4224422,Great friendly customer service. He had me up and running in no time.,2022-01-28 18:23:05,Kudo
2cd8ae46871149545c4a0e96cebb3557,243ea53987d54914ebb255b83cbb3526,AINST4219110,"I waited on hold for 30 minutes to get help. That is horrible. However, the tech that helped me was great so the lower rating is due to the wait time not service.",2022-01-28 16:27:00,Kudo
e7b04782875d41140fdced3d0ebb350c,f063b202871545d4c5520f6d0ebb352f,AINST4224108,just great pleasant service.,2022-01-28 18:11:30,Kudo
6d2ab24e87d5459047f1ca2e0ebb3543,22480a7187ddc950b4c1eb183cbb3535,AINST4220075,Tech was nice and efficient. Long waiting time to reach a tech.,2022-01-28 17:42:41,Kudo
b62d67bc87b1c1106eb197183cbb35d5,804aa33087b94558f03411373cbb3530,AINST4297165,"Tech was extremely helpful, quick and responsive.",2022-02-18 20:44:36,Kudo
4d25beca879945542e0633773cbb35ab,3ef9a64687dd4190b4c1eb183cbb35b0,AINST4223829,"The service agent i spoke with was kind and considerate to my problem, she helped me to resolve my problem and quickly.",2022-01-28 17:20:49,Kudo
d754b2c687514114b798b996cebb35cb,d7d26ef98719cd94c5520f6d0ebb35d1,AINST4220857,Blaize got my issue resolved quickly and professionally.  I was very impressed with the service I received.  Great job!,2022-01-28 17:17:25,Kudo
ccf3fa8287514114b798b996cebb355a,51ba220297598194cf74fbc3f153af71,AINST4223853,Blaize responded super fast to my request and was extremely friendly and helpful.  He asked for additional help when needed and got the issue resolved.  I was very impressed with the level of service I received.,2022-01-28 17:15:34,Kudo
62e07a0e8795c5548b81322d0ebb350a,a4067c4287d545548b81322d0ebb351b,AINST4222798,IT Tech was very helpful!,2022-01-28 17:02:21,Kudo
56a6e38687d14154e95263583cbb35de,a0ddd3c2871549548b81322d0ebb3511,AINST4225271,great service,2022-01-28 20:57:10,Kudo
edd863ce87d1c114b798b996cebb3564,9860570287d50154e95263583cbb353e,AINST4224904,Good service and very helpful.,2022-01-28 21:06:40,Kudo
ba6bdf30873909500fdced3d0ebb35b7,3fde72b087bd0954ab2096093cbb351f,AINST4295961,This was awesome service! Excellent work. Many thanks for adding this to our platform,2022-02-18 19:27:02,Kudo
8dfa6b8a87d5c9545c4a0e96cebb3547,23685746871149548b81322d0ebb350e,AINST4225121,"Ashley is great she always prioritizes the OR. However, if I just waited on the Service Now portal, & didn't message her on Teams, it probably wouldn't have been resolved as quicly.",2022-01-28 21:15:57,Kudo
9f222492971d8594cf74fbc3f153af88,994d4c9e87d50514b798b996cebb352c,AINST4226441,"""How likely are you to recommend this service to your colleague"".  This is not really a reasonable question, it's not like there are alternatives to getting IT support other than the help desk.",2022-01-29 01:17:12,Kudo
c1b05bf887b989d052beec273cbb35c6,23418bf88731c1905c4a0e96cebb35a6,AINST4296031,Actually had to drives that need to be mapped to Windows.  The Tech was able to solve the problem in a timely manner.  Thanks so much for your help.,2022-02-18 18:40:14,Kudo
d61c0c5297158594cf74fbc3f153af6a,8f5d805c879949d0c3f2ff77cebb3556,AINST4200787,Fixed the main issue. Great service.,2022-01-28 23:40:44,Kudo
cf8bc412871d099047f1ca2e0ebb35c0,363f6f0a8759c9545c4a0e96cebb3524,AINST4225690,"The IT Tech I spoke with was helpful, patient, and helped me resolve my printer problem and get it setup.",2022-01-28 23:38:20,Kudo
f681d7b087f989d052beec273cbb35c8,94efc73487b1811c47f1ca2e0ebb35ce,AINST4296463,fast excellent service with a smile,2022-02-18 18:43:54,Kudo
79e50496879d8910f03411373cbb3531,071ca38a87d50590b4c1eb183cbb355b,AINST4225611,"IT was very responsive to the service ticket. Kameron was so nice, efficient,  and helped set up the new docking station for me.",2022-01-28 23:13:40,Kudo
fcb2805e87d94d9052beec273cbb356e,462008128791c594f2187487cebb3554,AINST4226124,"The 2-step process is clunky.  Providing name, NUID, physical location, building ID, floor, and room number seemed like more detail than was needed to assist with a cell phone service request.  The second person was helpful and got the job done ok.  Wait times were low, which is great.",2022-01-28 22:59:40,Kudo
15cf770a87d98910f03411373cbb35e7,ae8e7f4a97d94594cf74fbc3f153af0e,AINST4226083,excellent internal customer service,2022-01-28 22:46:52,Kudo
f1be3f8e87998910f03411373cbb359f,16c2130e87954910f03411373cbb3501,AINST4224971,"Jon was great, accommodating, adjusted his approach to my higher technical skill level, understood, was flexible while remote and picking up the fixed laptop.",2022-01-28 22:42:16,Kudo
13a937c287110d545c4a0e96cebb358b,64a25f358795419047f1ca2e0ebb3515,AINST4222184,Rep was very polite and patient with me. He demonstrated excellent customer service.,2022-01-28 22:20:16,Kudo
0f96ff86879dc1506eb197183cbb3503,b7807b4187594dd02e0633773cbb35a8,AINST4209515,Great customer service from Corey Maurin,2022-01-28 22:06:51,Kudo
5b46b70287d189548b81322d0ebb358a,9244738e871dc9545c4a0e96cebb358c,AINST4225829,Excellent fast service!!!,2022-01-28 22:05:30,Kudo
9de23fca871d0594c3f2ff77cebb35cb,c1febe42875d45d4c5520f6d0ebb35aa,AINST4224464,Great service,2022-01-28 21:50:37,Kudo
3a407bc2871dc59047f1ca2e0ebb35e7,5d6e2f4a8799c5d4c5520f6d0ebb3532,AINST4225665,Service was very helpful and done swiftly.,2022-01-28 21:39:16,Kudo
dc8feb8687990594c3f2ff77cebb356a,09830fce87dd45d4c5520f6d0ebb35d2,AINST4224579,Great service,2022-01-28 21:35:48,Kudo
f9fb2e8a8759899052beec273cbb35c9,bdee9e4297d18194cf74fbc3f153af5b,AINST4223588,"Guillermo wasn't too technical with his questions, he understood my issue, troubleshooted all options. Very professional, excellent skills and customer service.",2022-01-28 16:40:44,Kudo
a2526e86875941506eb197183cbb359e,2fbf5a0287998d14e95263583cbb3575,AINST4223613,Excellent technical and customer service approach by the local IT team.  Very thorough communication before and after the event.  The amount of important information shared was extremely helpful to understand the diligence put forth in testing all devices to ensure that department operations were restored properly.  Thank you.,2022-01-28 15:58:44,Kudo
91ea756187d10d148b81322d0ebb353d,f557b1e1871d45d00fdced3d0ebb3537,AINST4216356,Excellent service! Shelly was very helpful. She reached out to me through Teams. And Doi was very efficient and did a good job fixing my printer problem.,2022-01-26 23:49:23,Kudo
afae597987998954f2187487cebb35b6,83ed997987dd89106eb197183cbb35e8,AINST4218559,I received excellent service.,2022-01-27 16:24:35,Kudo
7d336cd9877dc5908b81322d0ebb350c,1fc8e7a787214910f2187487cebb3523,AINST4279801,excellent service and quick responses!,2022-02-19 19:19:13,Kudo
386d3d7187958914ebb255b83cbb35e0,406fe1b187194914ebb255b83cbb35bf,AINST4219181,The technician was very nice and helpful!,2022-01-27 18:38:45,Kudo
0f47fd3987954d94c5520f6d0ebb35a9,377435f997150d54cf74fbc3f153af37,AINST4219365,I had to leave in the middle for a meeting and he continued to work on his own and even messaged me later to tell me the problem was fixed. Great service.,2022-01-27 18:12:08,Kudo
e464f13d8795c19052beec273cbb358d,3282b17987914d94c5520f6d0ebb350c,AINST4219294,Fast service that resolved my issue with great customer service.,2022-01-27 17:59:25,Kudo
4aab3219873109106eb197183cbb35e0,db1bb2d5873109106eb197183cbb35d1,AINST4299409,Excellent customer service.  Went about and beyond to find out why the system was down and how long.,2022-02-20 06:25:15,Kudo
9119a93187954514ab2096093cbb35c5,2df1511d8795cd900fdced3d0ebb3514,AINST4212063,His customer service was excellent,2022-01-27 17:10:01,Kudo
e15a566d8739891c47f1ca2e0ebb35d5,af57bedd87fdc5106eb197183cbb356f,AINST4299406,"he helped me perfectly. Thank you, sir. Also, I did not have to wait long at all. That is a perfect world. Thank you for everything, service team. Literally...Service NOW!!! Have a great day and please know how valuable you are to The organization you have chosen to serve :)",2022-02-20 22:38:08,Kudo
de87c17d875149d00fdced3d0ebb3533,b97609a187d10114e95263583cbb352f,AINST4214971,The technician was very patient and helped me through the entire process,2022-01-27 14:43:27,Kudo
edc63b3087b98590e95263583cbb354c,2bd9eb34877149500fdced3d0ebb3533,AINST4297150,Excellent service,2022-02-18 21:26:34,Kudo
a9b33dfd87f1411052beec273cbb35e2,34b271f187b94d905c4a0e96cebb358c,AINST4300456,Very nice tech explained everything to me as a new FTE.,2022-02-21 14:27:51,Kudo
aaee08b98795c114ab2096093cbb356f,ad3e403d879d8514ebb255b83cbb351a,AINST4217703,Customer service was great.,2022-01-27 10:36:05,Kudo
079d8ae587954514ebb255b83cbb358d,108b28e98715c150b4c1eb183cbb3559,AINST4214098,IT tech was quick to help me resolve my pingid problem.,2022-01-27 01:11:09,Kudo
1bbbcaed8755c554f2187487cebb3567,57480e2587590994c5520f6d0ebb3577,AINST4216812,excellent service,2022-01-27 01:02:58,Kudo
22a746698715c554f2187487cebb3502,167371a08711c990e95263583cbb359d,AINST4201401,I had great service and a quick response! Thank you for all your help!,2022-01-27 00:45:11,Kudo
03634ae5879dc5106eb197183cbb354a,50fae5a98759c5142e0633773cbb3543,AINST4215999,great service,2022-01-27 00:26:38,Kudo
a951c2e587d98550b4c1eb183cbb357c,988e3925871dc5106eb197183cbb3503,AINST4216579,"It was great prompt service, I only had to speak with one person.",2022-01-27 00:17:32,Kudo
5781023d8755c514e95263583cbb354b,6a0b9531879d0514ab2096093cbb3554,AINST4218456,"IT always provides excellent, professional service.  Sean is knowledgeable and always takes care of the issue.  I appreciate the work they do and service they provide.",2022-01-27 18:56:56,Kudo
08a3ceb98795c110f03411373cbb359f,ad7142f987d581545c4a0e96cebb35da,AINST4219839,Excellent customer service and care!  I've never received this good of service from IT (different company),2022-01-27 19:05:59,Kudo
0493c49587354d500fdced3d0ebb3590,a4d11e2087fdc5586eb197183cbb3586,AINST4292242,Excellent Service Person PERSONALITY,2022-02-19 17:00:55,Kudo
3e3dcefd87990d54f2187487cebb35d7,9f3c1531875949d00fdced3d0ebb3531,AINST4218494,"The IT people are always great, kind, etc., but I've been dealing with this for over a year without a fix. I would recommend this service because as far as I know, it's the only one we have!",2022-01-27 19:47:58,Kudo
1cea1e86879505d4c5520f6d0ebb35ce,b2b6124e87914d14ab2096093cbb351c,AINST4223447,Easy service,2022-01-28 15:26:05,Kudo
451916468715059047f1ca2e0ebb3577,8878d6ca87994154ebb255b83cbb352b,AINST4223474,Zena was able to resolve the issue very quickly and I am very grateful for her excellent customer service and prompt response!,2022-01-28 15:18:13,Kudo
be033ceb871d49d0b4c1eb183cbb35c2,85e8771f97950510cf74fbc3f153afd4,AINST4236239,"I reported 2 phones needing to be serviced, and our supervisor states that the technician refused to take both. I would recommend this service to my colleague because there is no other choice. The IT person who took the call was helpful and professional.",2022-02-01 23:43:19,Kudo
2a025e0287d98194f2187487cebb35d8,8f89aa7197518d54cf74fbc3f153af27,AINST4221036,Therese was very helpful. She knew who to contact to get the issue fixed. Great customer service skills.,2022-01-28 14:47:27,Kudo
2070160a87d5c510f03411373cbb3538,aadbc7b187d50dd0b798b996cebb3550,AINST4222037,Excellent customer service,2022-01-28 14:40:29,Kudo
ec75444587f9c954ab2096093cbb3503,aee4484987f1051c47f1ca2e0ebb3557,AINST4297787,great prompt service!  :),2022-02-18 22:30:40,Kudo
d37e4bf187190dd0b798b996cebb3503,248c433987918d14ebb255b83cbb35cf,AINST4222051,"Excellent service by Jefferson.  Professional, attention to detail with quick resolve of issue and prevention of this in the future.",2022-01-28 00:33:04,Kudo
b738004d877189500fdced3d0ebb3539,bfd63774877145905c4a0e96cebb35b6,AINST4297453,Because service great,2022-02-18 22:42:53,Kudo
48ba4c0d877105106eb197183cbb35e6,aaf38c0d877981502e0633773cbb35d9,AINST4297763,Excellent service as always - thank you!!,2022-02-18 22:53:34,Kudo
af58073d871145545c4a0e96cebb35dc,65f487b18719c1548b81322d0ebb35af,AINST4221844,The Service Desk agent was very helpful and pleasant.,2022-01-28 00:06:21,Kudo
164db23587110dd0b798b996cebb3592,691cf67d8755859052beec273cbb351e,AINST4221615,Great service,2022-01-27 23:17:55,Kudo
7f90363d8799cd142e0633773cbb357b,10cd28e587090d106eb197183cbb35a9,AINST4170391,technician was very helpful,2022-01-27 22:22:35,Kudo
5144ec4987b905106eb197183cbb3560,bfa3608d87310954c5520f6d0ebb35e5,AINST4298456,"As always, excellent customer service.",2022-02-19 00:45:20,Kudo
db91384d87bd0510ebb255b83cbb353e,97a0388987bd0510ebb255b83cbb3553,AINST4298617,Tech was knowledgeable and helped me resolve my issue fast. Very nice and explained things so that I can understand.,2022-02-19 01:43:38,Kudo
f1a9f70587398d54ab2096093cbb3545,dec8fb4d877d851c47f1ca2e0ebb3522,AINST4299042,"I got a new phone and didn't realize that I had to unpair PingID from the old device, which I no longer had.  The service desk rep, Marco I think, helped me quickly and got me back onto PingID and Global Protect just in time for my patient appointment while working remote.  Thank you so much for the great service!",2022-02-19 16:17:37,Kudo
51c1b46b871981d42e0633773cbb356e,26b5eadf87d105d0b4c1eb183cbb35db,AINST4234260,"Great service, helped me quickly",2022-02-01 23:37:44,Kudo
85140aac87314154ab2096093cbb35bc,e5c5fd1c87b105d847f1ca2e0ebb35b2,AINST4288903,"great, fast service.",2022-02-17 18:26:57,Kudo
23c838e78759811452beec273cbb359f,ced6e0ef8755411447f1ca2e0ebb351b,AINST4237489,The tech who helped was responsive and helped figure out the issue. I think KP IT should have put out an email about the email server issue impacting vendor emails. It would have saved me some time troubleshooting what was going on.,2022-02-02 00:08:28,Kudo
216c5cdc87798150c3f2ff77cebb3504,e4d9d81c87bd8118f03411373cbb355d,AINST4286328,The Service Desk person was able to resolve my problem quickly and made sure everything was working before we ended the call.  As far as how likely I am to recommend this service?  Do we really have a choice?  Where else would we go?  This rating is for the person that helped me.  May want to re-word this question.,2022-02-16 16:15:30,Kudo
eaa692c287e50d58b798b996cebb35ef,915b3dc68761811847f1ca2e0ebb3575,AINST4266235,Julius provides excellent customer service and has great communication skills.,2022-02-10 01:23:22,Kudo
ca0d5c98873d8114c5520f6d0ebb3580,156a509c97b94110cf74fbc3f153af60,AINST4286340,Excellent service with a smile.,2022-02-16 16:18:17,Kudo
d7b0ec1c87f5c114b4c1eb183cbb3596,6bf65010877d8118f03411373cbb35f4,AINST4286273,"They kept telling me because the Onyx system is not on the KP service application list that they couldn't help me and that I would have limited access to systems that KP does not support, but KP does support Onyx, it's just not listed on the KP service site.",2022-02-16 16:34:27,Kudo
ac85281487f5c514ab2096093cbb35fd,d053a0588775cd90ebb255b83cbb35c4,AINST4286588,The help I receive from IT is quick and easy especially when they can remote into my computer. I appreciate their knowledge because I know very little about tech stuff.  Thank you all =),2022-02-16 16:55:18,Kudo
9345824e87a10554f03411373cbb3515,75c4c24e87e14110c3f2ff77cebb3566,AINST4266505,Hp tech was awesome and helpful. fix the problem right away,2022-02-10 00:07:29,Kudo
13dfb5c687a14110c3f2ff77cebb3504,d3d6a94a97a5c9d0cf74fbc3f153aff4,AINST4265739,great service,2022-02-09 23:43:44,Kudo
