sys_id,instance,instance.number,string_value,sys_updated_on,response_category
b3c58e3287b58d10f03411373cbb3583,a97aa9ee87b101148b81322d0ebb35ef,AINST4311206,"This issue has not been resolved.  I received an email yesterday that the IT person had been trying to call, though they were calling an old number for me.  They asked me to give them a call at my earliest convenience.  Then I immediately received a second email stating the issue had been resolved when of course it has not.",2022-02-24 18:20:51,Issue Not Resolved
5f170247875905d047f1ca2e0ebb3582,b9244e43875d4d54e95263583cbb3590,AINST4229834,"I called several times and was told it was resolved, but the issue was not sent to HR IT team correctly as proper issue. No one called back as requested to allow me to explain issue. Kept getting closed and resolved. Issue is not resolved and several calls later no response from HR IT. The response was for a non manager to send back to manager. i am the ANM and needed to retract the eval that was submitted.",2022-01-31 16:33:39,Issue Not Resolved
3d6532fb87e985d02e0633773cbb35b7,daae0dfb87e1c9105c4a0e96cebb358b,AINST4280702,"My issue was not resolved, I was told the phone number should be 8-13 characters long and contain no alphabet or special charters and its working the was its supposed to. The IT person personally messaged me on team and asked me to send screenshots of just numbers being entered and it was 8-13 numbers, which I did,  and I was still getting the error message.",2022-02-15 14:07:02,Issue Not Resolved
81a1a8f087c501906eb197183cbb35fd,370c9838874981908b81322d0ebb3585,AINST4160246,Marcos did an amazing job. I came pretty abruptly in the morning and he still took in my laptop without an appointment. We initially thought we fixed the problem and after I TEAMS him he offered to help me again. I can tell he love what he does and really cares to help others.,2022-01-11 23:08:16,Issue Not Resolved
2d3d5eed87458d10b798b996cebb3539,6bc4835d87c9815047f1ca2e0ebb3543,AINST4169717,Technician gave good service.  The wait time was long and the issue is that we already have software on the machine but the software is changing.  Unfortunately we thought it was just a matter of requesting the new software but it requires another kind of ticket with various approvals.  There needs to be IT support to walk staff through the appropriate ticket submission process and forms in these situations rather than leaving staff to navigate it themselves.,2022-01-14 16:03:36,Issue Not Resolved
d5946a2987850d10c3f2ff77cebb357e,bd212ee98701c5105c4a0e96cebb35a0,AINST4171171,"i cannot log in my time view. 
""ID is revoked""...
 i reached out the IT department and they just gave me the phone number . however I cannot hold the phone for 1hr since i work.
is there anyway I can reach out the it team.",2022-01-14 16:35:48,Issue Not Resolved
f46526a987cd4550ebb255b83cbb3585,58ce18cd878d0510ebb255b83cbb35ef,AINST4162884,"Still do not have access to shared drive requested (or at least to the drive identified on ticket) and no call or notification of anything being done - just received notice that ticket was closed, checked access and still denied",2022-01-14 16:39:19,Issue Not Resolved
58c5b6e587c1cd10f2187487cebb356a,9dfce2a1870541106eb197183cbb35dd,AINST4171494,Nothing was done to fix the problem. A follow email was sent but if you don't know how to do screen shots and can't talk to someone so how does the problem get fixed. Trying to deal with this between patients is very hard to do.,2022-01-14 17:50:50,Issue Not Resolved
2e0007218785cd10ab2096093cbb3552,17edf6ad87c10950c5520f6d0ebb3564,AINST4171944,Technician did not fix my issue or wait to see if the issue does not happen again. Asked how do I contact him if the problem happens and he said it won't. Once he signed off the problem happened instantly. Not very happy with the customer service provided.,2022-01-14 18:35:46,Issue Not Resolved
578c0f25874dcd10ab2096093cbb35f5,0e672aa58789855047f1ca2e0ebb35f8,AINST4171314,"Problem not resolve yet ticket says it was.  Screen shot with supposed instruction I was sent to upload Covid booster card was the same steps that I went through to prior to calling the help desk, while Help desk was remoted into my computer, and again this morning after receiving the instruction which I had already done and redid them again prior to responding to the email.  So no the issue is not resolved",2022-01-14 19:30:27,Issue Not Resolved
0b48d3a1870981106eb197183cbb3529,4a8797ad87810150ab2096093cbb3588,AINST4172630,"quick, efficient and resolved in the same day",2022-01-14 20:21:46,Issue Not Resolved
c164afed87090150ab2096093cbb3585,23ec159d870109106eb197183cbb35e1,AINST4167088,"He was very nice and professional, but didn't understand that the APPs are given access to secure Kaiser WiFi for work emails and Teams meetings, etc.  He also didn't have an explanation for why KaiserGuest WiFi wasn't working either.  It turned out to be an internal problem, not my phone.",2022-01-14 21:14:36,Issue Not Resolved
beedabed87c981102e0633773cbb35b5,728d8f21870581106eb197183cbb3529,AINST4172375,"This indicates that there are options other than dont open a help desk ticket, so the last question seems pointless.  This feedback is not aimed at any one person.  I had a down system due to what looked like a trojan, so I would expect this to be expedited.  Took a couple days for this to finish out.  Secondly the resolution was posted and close with out any verification that it resolved the issue.  The instructions did not match this situation.  While I was able to get around the situation, I don't have a sense that it was resolved.  The person who initially took the call did a good job triaging the call.  I think it fell down a bit after that.  General observations for what it is worth.",2022-01-14 21:56:13,Issue Not Resolved
28aab3e587cd4950ebb255b83cbb3557,527afaa18709c55047f1ca2e0ebb35a0,AINST4171861,Issue was NOT resolved at all!.  The PC is still stuck on HP start and does not boot to windows.,2022-01-14 22:51:47,Issue Not Resolved
f6a208b987854150ab2096093cbb35e0,eb6539dd8745cd10c5520f6d0ebb3598,AINST4167805,I have not had the issued resolved or even been contacted,2022-01-14 23:26:53,Issue Not Resolved
c973c43d87458950ebb255b83cbb35c6,44e1b7e587c549500fdced3d0ebb3553,AINST4173201,"Anthony was great! Super helpful, not long wait, fixed the issue and was kind.  Thanks Anthony!",2022-01-14 23:30:18,Issue Not Resolved
7fba883997458150cf74fbc3f153af25,3abd2545878dc110c3f2ff77cebb35b6,AINST4165063,it is not fixed,2022-01-15 00:02:10,Issue Not Resolved
232651f1870dc950ebb255b83cbb3544,ef37f6ed87cd85500fdced3d0ebb35d0,AINST4171764,"The issue was not fixed, but the IT person who helped me was fantastic!!",2022-01-15 05:31:45,Issue Not Resolved
d39ec0ce87854110ab2096093cbb35b1,e4cffaa5874d09108b81322d0ebb3532,AINST4171993,"The problem got worse; seems like IT is guessing or hoping for a solution to a ""known problem"" yet a solution hasn't been found, which I find incredible with a company as large and resourceful as KP and KPOC.  Really, I think our IT department is incredible and do an incredible amount of work to keep us working, most of it we don't see because it's behind the scenes.  But when I'm told by KP IT that this is a known problem and ""we get several calls each day with this same problem"", then I think they need to work on solutions instead of work-arounds.",2022-01-15 18:57:33,Issue Not Resolved
afa3b4c687c54150c3f2ff77cebb35a2,9350753887b4811425bd97583cbb35f1,AINST4122949,Not resolved.,2022-01-15 21:39:30,Issue Not Resolved
c6fb379e87c5cd105c4a0e96cebb35f0,24e168b3873081500fdced3d0ebb358b,AINST4151231,"Again facing the similar issue, it looks like they have provided temporary solution not the permanent solution.",2022-01-17 06:53:03,Issue Not Resolved
a1a002a6874d0950b4c1eb183cbb352b,56e4d54d8709c51052beec273cbb358e,AINST4164409,I am still unable to access ACAD - the software is loaded - with no serial number,2022-01-17 16:32:44,Issue Not Resolved
8eca8ae287c5819052beec273cbb35ae,a838ca668709c1900fdced3d0ebb351d,AINST4177544,"Unable to resolve issue.  Same issue for many years, IT support just keep sending us to another department.  Useless, waste of our time.",2022-01-17 17:17:00,Issue Not Resolved
f0ea12a28781859047f1ca2e0ebb3597,bdf81e6a8785c9102e0633773cbb35a4,AINST4178107,My call was answered promptly and professionally.  I was promised quick resolution from another department and my issue was resolved as promised.,2022-01-17 18:27:23,Issue Not Resolved
c81f6aa6870d81505c4a0e96cebb35bc,4b02e22a8785c19052beec273cbb3520,AINST4178407,Issue has NOT resolved. Thanks,2022-01-17 19:55:32,Issue Not Resolved
2b1bf2e68745059052beec273cbb3538,7bf9f6e287c50d106eb197183cbb359f,AINST4179108,"Provider was kind and timely. However, was not able to resolve my need and help me to access client files sent by an outside provider.",2022-01-17 20:48:12,Issue Not Resolved
160d0322870185900fdced3d0ebb357a,6c176fe5870149500fdced3d0ebb35af,AINST4172961,The first IT person (M. Tafoya) made sure to confirm whether or not the service was actually completed.  Turns out there was another ticket opened by someone with my same name within a different department and a different area. The IT technician went the extra mile to confirm service was done and determined it had not been by double checking and was able to transfer it to the appropriate IT in my building. It was then completed in a timely manner.,2022-01-17 22:06:29,Issue Not Resolved
85330476874185508b81322d0ebb35a8,b91a376a87814990c5520f6d0ebb354b,AINST4180476,did not resolve issue and was not helpful to find solutions,2022-01-18 02:03:09,Issue Not Resolved
930b363e870101506eb197183cbb3569,62f7cfac874d8d500fdced3d0ebb35aa,AINST4157831,Nothing was resolved,2022-01-18 15:26:24,Issue Not Resolved
8c5bbe7a87058d50b4c1eb183cbb35e5,2bf1a83e87018d102e0633773cbb3598,AINST4180650,"Before I was even asked a single question about my issue my ticket was marked as ""Skipped Complete"" and ticket was Closed. This is not only not finished but the first communication I have had regarding my issue which I opened last week was received After the ticket was marked as Closed. I received a communication Off Hours via Teams Chat and not even email, and then because I didn't reply within hours (which is outside of business for me) my issue was marked Closed. Not acceptable.",2022-01-18 15:27:31,Issue Not Resolved
526847b68745c5505c4a0e96cebb354e,0e560ffa87c94110b798b996cebb352f,AINST4181923,I did not work with an IT resource.   I did receive an email to collect an old cell phone but I haven't received the new cell phone yet so the email is premature.,2022-01-18 16:24:45,Issue Not Resolved
d54e729987c1815052beec273cbb35e5,92bdfe9187c1815052beec273cbb353e,AINST4169581,"I don't use it to manage my work, but rather as a way to notify me of INC outside of work hours (I then login to performs the work).  I love how many notifications there are, and I can choose exactly what I want to be alerted for. This is so much better than logging in to check my computer every so often.",2022-01-13 23:49:34,Issue Not Resolved
7e8cb2d987c5c910b798b996cebb352f,5a97a61887ecc510adb064ec0ebb35dc,AINST4074437,"I had requested change default location for Onelink eProcurement and it has not been done, yet ticket was close. Location still indicates ""Riverside"" and I need the default location to be ""Parsons East Annex – Pasadena, CA""",2022-01-13 23:42:01,Issue Not Resolved
dca2769d8701c910e95263583cbb3579,e91fae518781c910b798b996cebb3564,AINST4169231,IT person tried to help me to figure out the issue and tried remotely to fix it and he saw what the issue and he tried to fix it and the problem is not fixed at all. He recommended  to try login back after few minutes due to I was locked out of Merge Pacs but after few minutes  I received an email saying it is resolved. But the problem is still there. I tried what he recommend me to do and still the issue is there.,2022-01-13 22:58:42,Issue Not Resolved
277d998187c509108b81322d0ebb3534,7bad89c9878dc110f2187487cebb35a0,AINST4164247,"no wait, fast and easy fix of the problem. 
not a 10, because past help is usually this great but not always.",2022-01-12 22:08:15,Issue Not Resolved
7e5da1f8878d0110c5520f6d0ebb354a,0b57083c87cd819052beec273cbb3515,AINST4159705,"Kelly was very rude, not helpful, changed my password without me knowing and unpleasant to work with.",2022-01-12 04:39:05,Issue Not Resolved
feeefff887c94110b798b996cebb35b5,3ffcbf3887c5c110ebb255b83cbb35c3,AINST4162132,She did not fix the problem- she just told me to go work somewhere else,2022-01-12 15:15:03,Issue Not Resolved
bb32900d87498110f03411373cbb3578,14dc77f487c5c110ebb255b83cbb35c2,AINST4162131,"Marjorie was able to answer my questions, specifically those that my ""trainer"" was unable to answer.  I will need to call back several times, as I begin to navigate these new software programs. As I am a ""FLEX"" officer I work from a different location each day. Not all  of the  computers I have access to are set up the same. Thank you for being there for  me.",2022-01-12 16:39:30,Issue Not Resolved
e8341cc987c581105c4a0e96cebb35fa,8c5ca47c8709c9502e0633773cbb35ad,AINST4160699,Fixed an issue caused by a bad design in one of the courses in KP Learn... it did not behave like other classes,2022-01-12 16:48:01,Issue Not Resolved
e2a81cc587014510c5520f6d0ebb359c,74335c4d87c90510c5520f6d0ebb3505,AINST4162545,"the help desk rep contacted me via teams - stated that he reset my jabber password and to try the app again.  The app worked after the reset, but this isn't the first or second time this issue has occurred since the installation of the app.  I was chatting with the rep on teams to try and get some more information as to how to avoid problems like this from happening in the future.  During the chat, I noticed that he ""resolved"" my ticket and then he stopped responding to me me on teams, but I can see that he saw my last question about how to prevent issues like this for the future.  Maybe train help desk reps (or just this one?) to ask, 'Is there anything else I can do for you before I complete your ticket?'  Thank you for your time.",2022-01-12 17:07:32,Issue Not Resolved
095c28cd874d81106eb197183cbb355f,69926320878101d047f1ca2e0ebb35ae,AINST4158710,the IT person was very friendly. the incident was resolved (took longer than i was told however it doesn't matter as long as it is done). I would definitely refer coworker to them if they had the same issue i did,2022-01-12 18:33:27,Issue Not Resolved
fc1874498749c1102e0633773cbb351c,0d045dac87c5c55026bc11773cbb352f,AINST4156815,"New.  Didn't really talk with anyone.  Someone helped me with this request.  That said, My Teams is fully working now - and same day from my request.  So, THANKS!",2022-01-12 19:24:46,Issue Not Resolved
85593c0187c1c110e95263583cbb35da,6b8cd353873c4150c5520f6d0ebb35c1,AINST4149343,"The IT person knew what the problem but did not have the item needed to fix the issue. He said he will return with the item needed, he might need to order it but he has not return yet.",2022-01-12 19:30:15,Issue Not Resolved
4c69f84987410510f03411373cbb35f8,e529284187094510ebb255b83cbb35e6,AINST4163218,"I was told someone with appropriate expertise would call me re: ClinConnect App unable to launch.  The incident was ""resolved"" - but no one has called me about the problem.  I still have the problem.  RE: likeliness of recommending - well - there is no other option to get help.  If there was a good alternative I might consider it. Therefore ""5""",2022-01-12 19:30:28,Issue Not Resolved
a16b09c58741c510ebb255b83cbb35f9,4af1cd4d8785c110ab2096093cbb3519,AINST4163945,"I am so thankful for IT. I had a feeling the problem was with Teams, but couldn't describe it well, and thought Teams just needed more of something to make it connect faster/better. We always have problems working from the same Excel worksheet, but everything we've tried, saving old versions and starting over, minimizing the amount of people on the worksheet, etc., haven't made a difference.
I have no doubt my IT provider has diagnosed the problem correctly. Microsoft really needs to step up its game. Or maybe KP needs to allow access to KPLearns with Microsoft (Excel, Power Automate/Flow), because problems like these are debilitating. We cannot function, and we waste so much time troubleshooting. I'm so sick of these issues, but even our analyst didn't have any more recommendations. Hopefully the recommendations that this IT person gave will work. I'm certain it will help immensely. Microsoft apps are too slow and incompetent to meet our needs.",2022-01-12 20:49:12,Issue Not Resolved
69bfc5418745c510ebb255b83cbb35d2,fd183c0187458510ebb255b83cbb3512,AINST4163707,"Although a fix was not available, they walked me through a faster work around that will be a huge time savor for me.",2022-01-12 21:08:03,Issue Not Resolved
8c1dd98587c50910c5520f6d0ebb35e1,93ef800d87418110b4c1eb183cbb3567,AINST4162461,I received an e mail about 11 am this morning stating that the support person was having trouble contacting me.  This afternoon I received an email that my ticket has been closed.  I never spoke to the IT support person.  My issue has not been resolved.,2022-01-12 22:06:22,Issue Not Resolved
3b46ad4187894510f03411373cbb3596,29754505874d8110c3f2ff77cebb3579,AINST4164057,"Super nice assistance from IT staff, little discouraged IT was given my personal cell and not my work number to connect initially - I ended up following up tho via teams and got issue addressed!",2022-01-12 22:46:47,Issue Not Resolved
f634265987498910e95263583cbb35db,5a8646998705cd1052beec273cbb3584,AINST4168310,"The demeanor of the tech.  Sounded disinterested, and didn't seem interested in what caused the problem (so it hopefully wouldn't happen again).  He didn't know why it started to work.  He seemed like he thought I was clueless.  I was NOT clueless - this is anew freakish problem",2022-01-13 21:55:48,Issue Not Resolved
2e49a14d878d05102e0633773cbb3532,407765cd87c50910ebb255b83cbb35a2,AINST4164899,"Ricardo Navarro took the initiative to troubleshoot, prepare a new laptop and problem-solve another issue that was occurring simultaneously.",2022-01-12 22:59:47,Issue Not Resolved
3367718d8701491052beec273cbb358f,3ca218f087850d50b4c1eb183cbb3517,AINST4160001,"The IT person is very knowledgeable & was able to fix the problem yesterday. 

However, this morning, I am experiencing the same problem with my laptop.",2022-01-13 00:01:35,Issue Not Resolved
df7dc2cd870589100fdced3d0ebb350c,376cb0cd87c58510ebb255b83cbb3516,AINST4163818,"IT Rep was absolutely wonderful! He not only resolved my issue but took the time to demonstrate ways to problem solve if it happens again. I appreciate his kindness and professionalism esp when our patients get better care overall as a result of smooth systems. Thank You! Sincerely, Dr. Batterson",2022-01-13 01:37:57,Issue Not Resolved
c4f03201874d89100fdced3d0ebb3559,7d187d4187058510f03411373cbb350a,AINST4165319,The IT person who helped me with my issue not only fixed it in a timely manner but was thorough and followed up with me as he said he would!,2022-01-13 04:12:50,Issue Not Resolved
bfdbb305870101105c4a0e96cebb354b,d0c90ad88701c150ebb255b83cbb3595,AINST4153602,"I was already feeling bad for making the mistake in the first place, but the IT staff made the process painless. I am so thankful for that. Please thank the IT staff for their professionalism and getting the job done. I'm not sure if they had smiles one their faces, but they sure did put a smile on mine.",2022-01-13 09:40:14,Issue Not Resolved
d68e49dd870d0d1047f1ca2e0ebb35a5,540f03898741c9108b81322d0ebb35f1,AINST4166014,My QCALM profile got deleted due to not logging in for sometime as I was working on KPMC which is using RTC. I had an urgent need to be able to access QC again. Raul F Castro understood my situation and helped in  re-creating my profile quickly.,2022-01-13 15:41:24,Issue Not Resolved
5efa195587490910b798b996cebb3548,73b32055878d8510e95263583cbb35d6,AINST4166407,The person was knowledgeable and was able to diagnose the issue and identify a solution that I would not even have known to ask about. Much appreciated!,2022-01-13 16:35:43,Issue Not Resolved
13fe519987c94910f03411373cbb35d3,c73b151187454d1047f1ca2e0ebb3510,AINST4167036,"Wilmington (sorry I misspelled his name) was very friendly and patient with me.  Explained the why of the pop up, what was happening and how he was fixing/fixed it. One pop up I have to live with until the next update I hope.  The other he was able to remove.  On another note, please bring back the option to have a call back instead of waiting on hold for the next available helper.  Thank you.",2022-01-13 16:53:16,Issue Not Resolved
80f4edd587c90910b4c1eb183cbb358f,5c1e8519874141108b81322d0ebb3593,AINST4166793,The issue with the Chemistry Prep Link being down was not an IT issue. Engineering rerouted the power from the non-working UPS and power strip to a new power strip which resolved the issue. A new UPS has been ordered from Instrument Repair.,2022-01-13 17:19:15,Issue Not Resolved
6446f191870149106eb197183cbb3543,cc433ddd87898d1047f1ca2e0ebb3561,AINST4167742,The link did not work. The ticket was close without resolution.,2022-01-13 18:34:57,Issue Not Resolved
cfde355d874d8d1052beec273cbb3591,38bd757a87740194e800862e0ebb35b5,AINST4141538,"VERY FAST SERVICE HOWEVER, ISSUE NOT FULLY RESOLVED",2022-01-13 19:12:31,Issue Not Resolved
07afd25d87c189106eb197183cbb3597,bf4a529187c58910b4c1eb183cbb3598,AINST4168741,"IT support people were highly responsive. However, they did not understand the issue. I ended up resolving the problem myself. I just restarted the computer tons of times

I am remote worker and had to replace my old laptop with a new one via mail. Getting the new laptop up and running was the issue.",2022-01-13 21:35:52,Issue Not Resolved
68d9cf32874901502e0633773cbb3597,1515d76a8745099047f1ca2e0ebb35d6,AINST4179743,Issue resolved and extremely nice person helped me. They were also willing to investigate another question I had.,2022-01-18 16:30:55,Issue Not Resolved
b870dff287890d10ebb255b83cbb3576,aec50c428781c150b4c1eb183cbb3548,AINST4174577,The same issue has been going on for months and it was never fixed. I have to wait long hours and when I get to an operator they wouldn't know the issue and escalate to other outlet that has nothing to do with the constant lockout of my account. Then I get circling around stating I input an incorrect password which I did not. It was an error happen at the beginning of my shift and it unlocks on its own. It was disrupting the daily task I need to do when I start my shift in the morning.,2022-01-18 16:59:53,Issue Not Resolved
d794eff68785899052beec273cbb35a6,5a5e9b6687414950c3f2ff77cebb35ff,AINST4179979,my service was not completed and no one knows how to restore my issue,2022-01-18 18:27:59,Issue Not Resolved
22e55fbb8705c190ab2096093cbb3582,c2f56e7f8709c190ebb255b83cbb35cf,AINST4197072,"So apparently we have a contract that every time our printer begins to get low on lower, HP is suppose to send a replacement with enough time before the ink fully runs out. The ink on our printer began to indicate low toner for almost two weeks, until the ink fully ran out. Nothing was sent until I personally called to have a replacement sent. Then I received an email that it was due to a computer issue. We moved into our new building with this new printer in late April 2021, and every time the toner is low we have to call to have a new one shipped. What is the point of having this automatic service if we have to call every time the toner is low, opposed to what is promised of a new cartridge delivered when the printer begins to indicate low toner.",2022-01-21 19:57:41,Issue Not Resolved
678a726387418d50e95263583cbb356d,32283b1b8738c910f03411373cbb3552,AINST4149933,"I was not contacted for this matter.  Ticket has been closed, matter has not been resolved.",2022-01-20 23:19:39,Issue Not Resolved
28e003ef9741c1d0cf74fbc3f153af13,a6e86e2f878941902e0633773cbb3508,AINST4194499,"we are not sure why the smart phrases are not working in the Letters section and no answer was found but - we got a work around
why does KPHC have to make everything so difficult?",2022-01-20 23:47:18,Issue Not Resolved
2a16cb63878541906eb197183cbb3513,a3143263874181902e0633773cbb35c8,AINST4194793,"They got to me right away even though on the online portal my request was denied. I explained over the phone what the issue was in more detail and they were able to bring a brand new keyboard and take the old not-working one back. Hopefully they will refurbish. Both Ivan and Ryan were very helpful, patient and professional",2022-01-21 00:10:07,Issue Not Resolved
9c398b2b87c581d0b4c1eb183cbb3562,3c99ce0b877cc110f03411373cbb35cb,AINST4144609,IT personnel did not contact me to confirm why I mistakenly assumed that Service now would not populate the service form with my old PC asset tag number.  Thus wrong AM number was entered and the request was not done.,2022-01-21 00:23:36,Issue Not Resolved
b9139b678785c1d0f2187487cebb354e,05a19f6f878505500fdced3d0ebb35e5,AINST4195463,"Mike listened to what I needed, and was able to explain quickly how to fix the issue, didn't try to advise me for stuff I was not asking",2022-01-21 01:06:51,Issue Not Resolved
