sys_id,instance,instance.number,string_value,sys_updated_on,response_category
be8a206687b18110c5520f6d0ebb353c,541b331e877d0110c5520f6d0ebb355f,AINST4308522,"My department was out of toner since February 11. There was a ""glitch"" in the system for the automatic replenishment and was never ordered. I reached out multiple times all the while I was not able to fully do my job duties and heavily disrupted EVS. I had very important documents to print out for an audit, schedules, daily sign in sheets; 11 days in total I was not able to do these tasks.

A ticket was placed to order toner and shown delivered but ended up being delivered to the wrong address.

I requested to have extra toner on hand in case of a ""glitch"" to not disrupt work flow process but was denied.",2022-02-23 17:03:37,"Time to Resolve,Issue Not Resolved"
216f69a087f185586eb197183cbb35de,e23d6de087710154ab2096093cbb355e,AINST4291162,"This ticket sat for months because I wasn't aware (didn't get a notification) that the first IT resource asked me in the ticket for my availability the day of submission.  Months later I ran across the ticket, adding a note for my availability and to ping me on Teams....with no response in the ticket or on Teams - until it was assigned to Jeffrey Rugato.  We had a 4 minute Teams chat conversation with resolved my issue.  If only ALL Help Desk contacts would be proactive via Teams Chat for communications because customers don't have time to keep checking all open S.NOW tickets to see if IT added a note asking for our availability.",2022-02-17 16:56:37,"Time to Resolve,Issue Not Resolved"
0ac1931587a90190e95263583cbb3512,aa074b5597a98990cf74fbc3f153afef,AINST4256263,"Called to request keypad/badge entry pad on both the Franklin dock door and Franklin receiving door be looked at.  Starting today the keypad portion does not work on either.  You can still badge in - but our regular drivers do not have badge access, therefore the use the 4 digit code.  This is still not working on either door.",2022-02-07 21:46:12,"Time to Resolve,Issue Not Resolved"
4e9b69f387994918f2187487cebb3551,6a46a47f87d58110e95263583cbb3508,AINST4240112,"I Called yesterday, took 30 minutes to get a live person. Live person not able to fix. (we only  have this one printer in our office) I was told that a local IT person will come to check on the HP printer. Local IT only called for the printer model AM # and to route to HP that all happened yesterday, Early yesterday no one came.  I had to call gain this morning. I was not happy  that it was not fix yesterday. The HP tech came the the printer is working now.",2022-02-02 22:28:52,"Time to Resolve,Issue Not Resolved"
8509366d8781cd10b4c1eb183cbb35fe,d3d7b2258785c55047f1ca2e0ebb35ea,AINST4171785,"I called the help desk Thursday at 8:15 a.m. (already 15 minutes late for my 8 a.m. patient). IT representative couldn't fix my problem - said they'd mark the matter urgent. I never heard back. I was working from home that day so I drove into the office to catch up on missed patient appointments. By the end of the day, no one contacted me. Now it's the next day and still haven't heard anything.  This is not my usual experience with IT. Usually the assistance is outstanding.",2022-01-14 18:05:05,"Time to Resolve,Issue Not Resolved"
cff9c2a9871d4d145c4a0e96cebb35ca,efb3fc61871945142e0633773cbb35a3,AINST4214423,I could not log into my computer at all and my account was disabled. I  provided the tech with both my cell and home phone number as I work remotely. I did not get a call that they had re: connected my account until I called them back at 3:45 and they said we reconnected you at 10;45 this AM.  I was unable to work at all today because they did not call me to inform me the problem was resolved.,2022-01-27 00:55:19,"Time to Resolve,Issue Not Resolved"
e0021fdd87a94d146eb197183cbb3539,c31d435587254114f03411373cbb355d,AINST4256422,It took 3 weeks for someone to come fix the printer issues.  I put in a  new printer request and it's been a month and do not know when the ETA for new printer.  Very frustrating to call to not being able to get help with the only printer we've in the lab.  We spend many hours trying to fix this old printer and wasting a lot of time at that.,2022-02-07 21:47:12,"Time to Resolve,Issue Not Resolved"
7fa6e1068721411847f1ca2e0ebb356d,ded7600687694d90e95263583cbb358e,AINST4264068,quick response and fixed the problem within 10 minutes so the provider did not have his clinic day disrupted,2022-02-09 21:53:44,"Time to Resolve,Issue Not Resolved"
3b4608c38745cd9047f1ca2e0ebb35f1,b334c76a87c945900fdced3d0ebb352c,AINST4179339,"He reached out making sure to check if the issue had been resolved and completed. The first ticket I had, I followed up 2x via email saying it's not resolved no word. This one, after verifying, I was able to connect again the next day and he referred to an expert since it didn't seem to work. He followed up and made sure it is up and running. Others don't even check on you and they close the ticket.",2022-01-18 20:55:12,"Time to Resolve,Issue Not Resolved"
cbc0aeaf878d0dd052beec273cbb3514,b7886881873005d0662ea79d0ebb35a0,AINST4125372,"Today is January 20th, 2022 and I still have not received my dialing pad for teams which forces me to use my personal phone when calling patients when working from home. I recently called IT to follow-up and the person responded in a condescending manner as if I did something wrong.  Meanwhile, it was never set up.  My manager and I followed directions and are awaiting approval, once again.  I usually have a great experience with IT support; friendly, helpful, timely. However, occasionally I will be connected with someone, who ""talks down"" to me when I am having perfectly reasonable requests and I show them respect and patience.  I expect reciprocation of respect and patience.  On a positive note; Leo Wright is great, he went ""above and beyond"" when I needed help. Most of the staff is great but some may want to watch their 'tone'.  I hope this is helpful.",2022-01-20 21:27:07,"Time to Resolve,Issue Not Resolved"
599153a58731c91c47f1ca2e0ebb35d3,d7f8298487214910e95263583cbb3562,AINST4244419,the issue is not resolved it has been 2 months waiting to add my secure chat to normandie instead of oc,2022-02-21 02:39:31,"Time to Resolve,Issue Not Resolved"
2176000487f1499847f1ca2e0ebb35c6,9018bfeb87a54910f2187487cebb352b,AINST4280179,"Virtual IT Tech, Cody Davies, was a lifesaver!  We were doing a dry run to prepare for a Teams meeting to prospective Lab interns and nothing was working -- the video would not play on 2 desktop computers, the Teams app would not play the MP4 files, etc., etc.  Cody saved the day and I wished I could hug him for his efforts in resolving the many issues we were experiencing!  Kudos to Cody!!!",2022-02-15 20:01:10,"Time to Resolve,Issue Not Resolved"
13c8f4678770c910c3f2ff77cebb353c,4cd428ab87bc8910c3f2ff77cebb353e,AINST4150653,"inability to resolve my issue and I was told it would be resolved 2 months ago.  Also, when I call, you do not listen, you interrupt without  hearing the entire issue",2022-01-08 03:37:04,"Time to Resolve,Issue Not Resolved"
dc8b1d8b8770c11052beec273cbb356a,e39a19c38774451047f1ca2e0ebb358d,AINST4143158,I still can't access mainframe. I have had technicians remotely re-install it on the computer before so not sure why I need to wait 10 days before it gets fixed on this computer.,2022-01-06 16:51:43,"Time to Resolve,Issue Not Resolved"
90be40e687794dd0e95263583cbb35e6,f4e8df128779c9d0c3f2ff77cebb35b0,AINST4308319,"I opened this ticket 13 days before I saw any movement on it.  I noticed that the ticket was passed off to other assignees over and over again who all commented ""Work in progress"" but yet it still didn't get completed.  This was unacceptable.  I had to reach out to the person it was last assigned to in order to get it taken care of.  Not a good way of doing business.",2022-02-23 15:01:58,"Time to Resolve,Issue Not Resolved"
3569b49e8771895c47f1ca2e0ebb35ae,30937456877d4d10ab2096093cbb35bd,AINST4307093,Sending me a job aid doesn't resolve the issue. I already had the job aid and the primary dx had been set and it still was not populating. 19 days later.....,2022-02-22 23:30:05,"Time to Resolve,Issue Not Resolved"
b4e653f187b541d0e95263583cbb35ef,8f525739877949d0b798b996cebb3516,AINST4302316,it appears that the request fixed the issue and I have the correct access. It took almost 5 working days. Granted it was not a major work stoppage. I feel request could be managed at a faster pace.,2022-02-21 21:41:11,"Time to Resolve,Issue Not Resolved"
d8fe3aa5870d41106eb197183cbb3581,9234c889870d4110b4c1eb183cbb354f,AINST4162229,"The issue in not fixed. the cables are not adhered to the wall properly and my chair and my foot still gets caught in it. 
I have asked for this to be taken care of over 9 months ago. many requests put in.  I think I may have to do it myself to prevent my own injury.",2022-01-14 18:30:59,"Time to Resolve,Issue Not Resolved"
384816f487d5c114f03411373cbb351b,46efc23887110dd08b81322d0ebb3539,AINST4203351,"30-60 mins, wait time for rep. to answer.  When answered still unable to help with major issues, could not even access KP Support to view my issues. and now I get email on monday 1/24/22 saying issue resolved because another employee is able to use the desk? so when i rotate in on Monday 1/31/22 to office, im sure i will have the same issue because its under my log on??  someone should of came in person that same day from local I.T - nothing has been resolved.... process seems useless. Also I called twice to I.T on same day, same issue with two different computers - so yeah someone should came in person on Friday 1/21/22.",2022-01-24 18:02:14,"Time to Resolve,Issue Not Resolved"
7323e4f28778051067ada6883cbb3509,4a871472873c495490d5ea4e0ebb351d,AINST4138643,"The wait time and the fact that I did the same thing yesterday, thought my issue was resolved, but had to call again and wait today.  I'd also like to mention today's Rep. ""Sean"" was very efficient, pleasant and had me back to work in just minutes.  (after the 47 min. wait on hold)",2022-01-05 18:07:10,"Time to Resolve,Issue Not Resolved"
1aa3598c872501182e0633773cbb35cc,3d229dc087e90514b4c1eb183cbb3599,AINST4243902,you constantly mess with my computer this morning I lost my screen saver that I have had for 12 years I am now staring at a black screen  I cannot work like this the technician said gee I'm sorry I cannot fix this,2022-02-03 15:22:46,"Time to Resolve,Issue Not Resolved"
fd90240b87c5c1506eb197183cbb3514,004e94cf87cd8d10e95263583cbb3510,AINST4184738,My issue with not having access to Cortext on my phone has not been resolved. I was told that they will contact me but looks like the ticket has been resolved today. INC13159926. I'm confused because it's still not letting me login.,2022-01-18 22:50:01,"Time to Resolve,Issue Not Resolved"
070dbbc087fd099052beec273cbb3529,feeaacd8876589d06eb197183cbb35ed,AINST4247857,"Laptop shipped by DMM, it has been 6 months, and my manager has approved the purchase of FileMaker Pro which is required to do my timecard twice and it still has not been loaded. I have however received several impatient emails about returning my old laptop, and responding with ""please load the software I need to work"" seems to fall on deaf ears. Multiple requests have also been put in to remove the bitlocker encryption, which Clin Tech has had issues with for the 13 years I have been here. With bitlocker on I can not update the medical equipment with new software, something that Kaiser requires I do. What is the point of giving me a new laptop every two years if it always takes a year to get the new one working properly.",2022-02-16 13:58:31,"Time to Resolve,Issue Not Resolved"
32c80e148701c150ebb255b83cbb357f,de18ce9c878dc5500fdced3d0ebb3555,AINST4153535,getting access to a shared drive to do my job takes forever and still currently working on it. I started my job 1 month ago and still don't have access to the folder I need. I've been in contact with IT service desk > 5 times with multiple tickets placed but still not fixed.,2022-01-10 17:22:00,"Time to Resolve,Issue Not Resolved"
9a3d6e7987b501d0e95263583cbb35bf,1c5d3c7d8739011052beec273cbb353f,AINST4300212,"Nothing was done after 4 months. The clearly stated problem, still exists ... untouched.
 ---
Nicole M Smallwood <Nicole.M.Smallwood@kp.org>
From: SERVICENOW at KP <kp@service-now.com>
Date: Monday, February 21, 2022 at 2:31 AM
To: Gregory B Presedo Floyd <Gregory.B.Presedo-Floyd@kp.org>, Nicole M Smallwood <Nicole.M.Smallwood@kp.org>
Subject: Incident INC12665398 resolved
-----------
The incident: INC12665398 you submitted on 2021-10-13 18:58:37 has been resolved.
The issue submitted was: J/E/N/K/I/N/S (silently fails) to send email to , DL-EMSCM-notify-econsult_p2ckp.org@kp.org
The incident was resolved with the close code of: Answered Question (<<< But ? However, No question was asked )
The incident was resolved with the close notes of: 
Hi, Kindly create a jira request for this. Hence this incident is considered as closed. 
Thanks.
Incident:	INC12665398
----------
State:	Resolved
CI:	ADTA Jenkins
Category:	Other
Assignment group:	Cloud Application Services DevOps
Affected location:	NCAL-PTC-Pleasanton Tech Cntr Building D
Opened date/time:	2021-10-13 11:58:37 AM PDT
Short description:	J/E/N/K/I/N/S (silently fails) to send email to , DL-EMSCM-notify-econsult_p2ckp.org@kp.org
Requested for:	Gregory B. Presedo Floyd
Requested for email:	Gregory.B.Presedo-Floyd@kp.org
Contact number:",2022-02-21 18:39:08,"Time to Resolve,Issue Not Resolved"
7c9da66a87690dd0e95263583cbb359c,7a42c39187254d9447f1ca2e0ebb35f2,AINST4256152,I have been waiting 3 days for my phone to get fixed and I'm still waiting. I need to have my phone to do part of my job.,2022-02-11 16:20:24,"Time to Resolve,Issue Not Resolved"
0e6ef2f18731cd908b81322d0ebb3514,80f97ef187f18d90c3f2ff77cebb35be,AINST4301896,"This has taken me all day.  I first called the help desk this morning, when I couldn't log in. The analyst finally told me that all I needed to do was go to a KP facility and connect to the KP network, and it would be fine. I went to WP1 and logged on via wireless connection. Called the Help Desk again. The analyst walked me through a bunch of stuff, then said he'd open a ticket for an IT person there in the building to come and help me. I waited about an hour, then Stanley sent me (via Teams) the information to escalate. I called that phone number and was told that my request was not in the queue for a live person. He said he'd get it into the queue.  About ten minutes later, an IT guy there in the building (I don't have his name), came into the lobby to meet another employee.  I asked him if he was aware of my issue (I was completely unable to get into my laptop and therefore, unable to work at all), and he was quite rude. He told me that he was there for this other employee and when he was done with her, he was headed to Lakewood. He did not even advise me to call the Help Desk again, and in my opinion, he was quite rude.  I gave up and came home. I kept checking the online ticket from my phone, and added several comments.  Finally, Sasha called me. I went BACK to Waterpark, where she connected me to a docking station in the hoteling space and we were finally able to get me connected.  Sasha was great - the other guy, not so much.  There was no call for him to be that rude to me.",2022-02-21 19:54:13,"Time to Resolve,Issue Not Resolved"
5b7df78687594d9052beec273cbb3593,64cfab42875509542e0633773cbb35aa,AINST4225703,Tech was very accomadating to meeting me to pick up and drop off the IPad. I did not have to travel and hour and half to go to Capitol Hill or Bellevue to get my IPad fixed. It was very quickly fixed (1 day) and tech provided lots of support and updates relating to the progress.,2022-01-28 22:36:54,"Time to Resolve,Issue Not Resolved"
6a7578ba87788d5425bd97583cbb3568,6c527cf6873441941e5685d7cebb355a,AINST4139519,I had started calling for this issue on 1/3/21 morning.I did not get a call back until 11 am today. I called the help desk and Janielle helped in just few minute. I really appreciate her help.,2022-01-05 19:27:05,"Time to Resolve,Issue Not Resolved"
ee5f3e25872909505c4a0e96cebb3517,71cb439987a1c998c3f2ff77cebb35c9,AINST4256386,It took 3 days to get the issue resolved.  I called the incident in on a Friday morning around 0445am and as of Monday morning at 0700 we still didn't have the issue resolved.  I requested my department manager to follow up with IT help desk with this ticket number to expedite the repair at that time (0700). I work night shift so I was not here when the IT representative came in to resolve this issue Monday afternoon. Thank you,2022-02-08 15:04:10,"Time to Resolve,Issue Not Resolved"
f718f13f8715c91447f1ca2e0ebb3527,7b07b9b787d1c594b798b996cebb3579,AINST4242288,"ease of access, usually do not have time to take care of issues but today i sat and took the time and it only took less than 15 min. to assist with what kind of ticket for me to place",2022-02-02 23:23:35,"Time to Resolve,Issue Not Resolved"
d738ab1c87a50110ab2096093cbb35aa,0687a11887258d10e95263583cbb35df,AINST4248173,"I already have access to the Pyxis as a RN and I noticed when I went into the pyxis today. My screen appearance has changed. The screen has 3 options at the bottom of the screen. “ Discrepancies, maintenance, user preference.”  I’ve never seen this before. 
Can my pyxis account be changed back to it’s original type?

What I’m requesting is on my Onelink account, have  access to the “Supply/Demand WorkCenter”. Presently my role is the Sr Cost Specialist
Thank you",2022-02-04 20:50:24,"Time to Resolve,Issue Not Resolved"
acbd2b078719cd506eb197183cbb359c,556b2fcf879dc5d4f2187487cebb35f4,AINST4232948,it took over a month to resolve and there has been 0 communication since first submitting the ticket. This also involved errors in information in a member's chart and still took 1 month to resolve.,2022-02-01 00:01:50,"Time to Resolve,Issue Not Resolved"
b1d05f1487498550f03411373cbb3535,663276c787f80510c3f2ff77cebb35d0,AINST4145733,"The day I called in about this issue Monday January 3, 2022. I was told that I would be contacted the next day and I was not contacted at all, just an email with the case information and no resolution three days later on Thursday January 6, 2022. The resolution was that the website was ""working as designed"" which I take as it is not supposed to be working at all which is odd and completely irresponsible to not inform the people that use it and need it for their personal information and use of. I am not happy with just being ignored and that is why my review is of the lowest rating of Not at all likely and Not satisfied with this service I received.",2022-01-10 22:36:46,"Time to Resolve,Issue Not Resolved"
cbf3fd8f8734c1105c4a0e96cebb352a,3cf9e8be87b0499093a285dd0ebb353f,AINST4139235,"A encounter showed up in a shared inbasket from 2017 - I was told by the first person who received my quick question that it would be taken care of, then I received a message that a provider needs to go into my inbasket and done it, however because its from 5 years ago, the providers do not feel comfortable closing it because its not their patient and they dont want to be tied to the encounter. So Now I just have it in my inbasket.",2022-01-06 18:38:41,"Time to Resolve,Issue Not Resolved"
2d088ce8876d0110ab2096093cbb35b8,4f8bff0c87e581108b81322d0ebb357f,AINST4247665,"she sent me email regarding my incident number that it is fixed and has 3 business days to reply.  I dont have access to my work email at home. When I read the email, I clicked on the ServiceNow portal to reply. I could not open it and it says error. No access. I called HR and they said, they don't handle Incident numbers.  I tried to type my ticket number and it does not show on the search button.  Maria De La Pena sent me a message on microsoft team, but I could not open it because I have no access to microsoft team.  I also received an email from her that is intended to another person named Beatriz.  She's mixed up with my incident number with another person.",2022-02-04 23:09:16,"Time to Resolve,Issue Not Resolved"
d272aa6b876145d0b4c1eb183cbb35c6,b3ff512b872181d0c5520f6d0ebb3583,AINST4276631,"I never received a resolution. The RITM states that multiple emails were sent, but I never received anything in my personal email. I am not sure where those emails were sent to, but none of them were sent to me. All I received after 6 months was an email saying that the request was closed incomplete",2022-02-14 18:05:50,"Time to Resolve,Issue Not Resolved"
7c5bc11f8785c990f03411373cbb35a8,45ada85b87090550e95263583cbb3566,AINST4188052,Both IT people I spoke with this morning were not able to help me.  They did not seem to know or understand the issue.  I needed MS Access to be reinstalled.  Seems like the situation is worse now.  I'll call IT again next week as I am very busy with clinic in the next 3 days.,2022-01-19 20:35:12,"Time to Resolve,Issue Not Resolved"
e7fc415687f985902e0633773cbb350e,2f450dda87358d900fdced3d0ebb35ef,AINST4307522,could not access mainframe . password did not work and over 60 days since I used it.,2022-02-23 00:55:39,"Time to Resolve,Issue Not Resolved"
6e376bcf877981102e0633773cbb35cb,437fe28b87fd4110c5520f6d0ebb3555,AINST4318168,"The IT person on the phone was helpful and pleasant to talk to. I called at 7pm because my computer was not working and I needed it for patient care the next morning. They came at 8 am the next day to take the hard drive and returned it back around midday, so I only had to use a laptop for a little while.",2022-02-25 20:04:58,"Time to Resolve,Issue Not Resolved"
d2041b3687f58154b798b996cebb35cc,3932877687718914e95263583cbb3508,AINST4316142,"Couldn't get ahold of chad for 3-4 days ( the guy that was helping me) left voice mails (3) Also , they told me to send computer with charger, but on return, they didnt send me back my charger ! When I complained , they said to keep calling chad !

also loaner never worked. It was password protected. Chad tried to help by wiping memory clean, but still never able to log on.",2022-02-25 00:02:38,"Time to Resolve,Issue Not Resolved"
f8eefed5874545108b81322d0ebb3557,870d3551870d8d1052beec273cbb3538,AINST4168042,"The messge states that the issue was resolved as when they checked I was logged in and running.  I did not use my computer on 1/12/22 due to the problem.  I used a spare laptop.  I was able to log in on 1/12, but not able to use the epic function which I need to complete my work.  As I told the tech this has happened before about a week ago and the next day it worked, so it is an intermittent problem. As with 1/12/22 it did not function properly, however today it is.  I can call again when it happens, but I'm not happy with the thought that it is going to happen again.  I will call you when it does. Thanks.",2022-01-13 23:52:16,"Time to Resolve,Issue Not Resolved"
79037cf387dd4d540fdced3d0ebb3592,f5af60b7879145d45c4a0e96cebb3583,AINST4240375,"The IT employees are friendly and helpful; however, the amount of time it takes for our misaligned printer to be troubleshooted is unsatisfactory. There needs to be another option to submit a ticket for this issue because our department has at least 1 of these issues present itself once a month or more.",2022-02-02 18:21:43,"Time to Resolve,Issue Not Resolved"
3c4090a787b88910c3f2ff77cebb35e6,93678353877c0150c5520f6d0ebb35aa,AINST4148807,The person at the national service desk did not take my concern seriously initially .  I explained to him that the computer which is only a few months old had crashed x3 within the past 2 week.  He said this is fairly normal for a Kaiser computer to his experience and was laughing and his coworker was laughing also in the background.  Very unprofessional and upsetting.,2022-01-08 00:39:56,"Time to Resolve,Issue Not Resolved"
a5fb639c87cdc5505c4a0e96cebb35c3,2df667d887894550b4c1eb183cbb35be,AINST4156148,Situation was not resolved. On Friday 1/7 Sasha IVanisevic asked me to call and they would leave the ticket open for 30 days. On Monday 1/10 Kevin M. Mack  closed the ticket before I had a chance to respond. One working day is not 30 days.,2022-01-11 00:35:16,"Time to Resolve,Issue Not Resolved"
46961eab872585d0ab2096093cbb354b,de91122f872505d0b4c1eb183cbb3519,AINST4277406,printer not working.  no idea if IT support is coming to see what the issue is.  IT informed it is not printing properly has variable copying. Was informed cartridge has alot of ink.  Maybe the case but has not been in operation for ~ 2 years so perhaps ink dry.  I'm not IT so someone should come out!,2022-02-14 17:13:57,"Time to Resolve,Issue Not Resolved"
81a33b4a87b145d08b81322d0ebb3587,8d507f35873d4d502e0633773cbb3541,AINST4302788,I initially submitted the request in Sept and then again in October finding out that an attachment was also required (not familiar with the process).  No one would respond to multiple requests around ETA on either service request for the next few months.  Build was finalized on 2/2/22.  Would have liked a chance to review before it was put into production as there were some missing items.  Response time to those issues were quick.,2022-02-22 18:25:17,"Time to Resolve,Issue Not Resolved"
8ab38cb587a1c510f2187487cebb35e2,553736fd87954914e95263583cbb35f0,AINST4221457,"Rep who assisted me was very nice, felt confident that he knew what the issue was-which was certain users system wide. I felt the issue would be fixed same or next day. No resolution, still cannot receive emails which is why I rated a 0. I set up my phone to receive the login code yet I prefer to have it arrive via email.",2022-02-08 20:02:52,"Time to Resolve,Issue Not Resolved"
